,Name,Purpose
0,Ryan-Chambers,Decentralized analyzing pricing structure for transform best-of-breed solutions
1,Joseph-Perez,Devolved well-modulated focus group for innovate viral applications
2,"Sandoval, Ellis and Trevino",Managed zero tolerance support for orchestrate transparent e-markets
3,Poole Ltd,Cross-platform asynchronous complexity for redefine collaborative channels
4,Ortiz-Cuevas,Organized even-keeled analyzer for syndicate B2C technologies
5,Mathis Ltd,Grass-roots system-worthy attitude for harness strategic ROI
6,Martinez-Griffin,Re-contextualized uniform circuit for transition sticky networks
7,"Lambert, Smith and Campbell",Universal logistical info-mediaries for innovate visionary supply-chains
8,"Mccarthy, Garcia and Ray",Sharable discrete ability for scale transparent users
9,Valdez LLC,Versatile methodical model for scale enterprise niches
10,"Hunt, Johnson and Anderson",Multi-lateral empowering open architecture for maximize dynamic info-mediaries
11,"Anderson, Houston and Watson",Multi-lateral incremental analyzer for unleash scalable mindshare
12,Brown Ltd,Organized motivating support for grow front-end vortals
13,Perry Ltd,Mandatory holistic function for synthesize customized convergence
14,"Nash, Cline and Garcia",Visionary asynchronous strategy for incentivize proactive portals
15,"Rodriguez, Roman and Morales",Implemented modular array for expedite extensible supply-chains
16,"Summers, Martinez and Andrews",Face-to-face empowering monitoring for envisioneer impactful e-business
17,Hall and Sons,Stand-alone secondary system engine for engage world-class relationships
18,"Davis, Thomas and Gonzalez",Visionary disintermediate extranet for exploit frictionless e-services
19,Nicholson-Hall,User-friendly next generation hardware for brand virtual e-services
20,Maxwell and Sons,Multi-tiered didactic complexity for drive e-business e-services
21,Brown-Rogers,Object-based contextually-based portal for orchestrate clicks-and-mortar communities
22,"Bennett, Burton and Lopez",Configurable 6thgeneration algorithm for extend turn-key functionalities
23,Reed-Jackson,Ameliorated real-time success for empower B2C action-items
24,Houston Group,Progressive human-resource moratorium for embrace bricks-and-clicks eyeballs
25,Becker-Berry,Face-to-face real-time extranet for architect synergistic content
26,Charles and Sons,Horizontal user-facing software for visualize compelling eyeballs
27,"Lewis, Obrien and Warren",Realigned 24/7 attitude for facilitate one-to-one applications
28,Bryant-Vincent,Open-source coherent forecast for enhance frictionless relationships
29,"Cox, Luna and Sanders",Reduced content-based concept for leverage 24/7 infrastructures
30,Burke-Carroll,Assimilated responsive strategy for aggregate granular web services
31,Duncan PLC,Extended grid-enabled interface for engage mission-critical functionalities
32,Rios-Gentry,Up-sized 4thgeneration collaboration for transition visionary architectures
33,"Perez, Martinez and Morris",Profound well-modulated conglomeration for orchestrate killer partnerships
34,Hawkins PLC,Enhanced attitude-oriented leverage for reinvent proactive metrics
35,"Butler, Smith and Fletcher",Distributed national intranet for matrix intuitive web-readiness
36,Robinson PLC,Total disintermediate capability for benchmark extensible channels
37,Bryan PLC,Stand-alone transitional monitoring for enable visionary models
38,Hays PLC,Profit-focused analyzing success for envisioneer turn-key portals
39,Rodriguez PLC,Fundamental solution-oriented neural-net for productize 24/7 web-readiness
40,"Bowman, Morales and Aguilar",Multi-lateral attitude-oriented installation for disintermediate wireless partnerships
41,Duarte Inc,Organic bottom-line architecture for orchestrate strategic functionalities
42,Romero Ltd,Quality-focused dedicated open system for scale B2B web services
43,"Wilson, Osborne and Smith",Business-focused next generation utilization for architect out-of-the-box web services
44,"Washington, Zhang and Hooper",Digitized actuating structure for utilize value-added functionalities
45,Gomez PLC,Switchable hybrid capacity for disintermediate world-class vortals
46,"Brown, Allen and Fritz",Optimized bottom-line service-desk for re-intermediate global metrics
47,Brown-Andrews,Monitored client-driven emulation for strategize integrated applications
48,"Walker, Snow and Williams",Customer-focused system-worthy moratorium for e-enable mission-critical methodologies
49,Finley-Mercado,Open-source zero-defect success for reinvent impactful content
0,Goodman-Davis,Balanced logistical contingency for orchestrate plug-and-play e-tailers
1,"Harris, Reese and Warren",Inverse analyzing orchestration for unleash cross-platform applications
2,"Burton, Sullivan and David",Balanced client-driven matrices for revolutionize distributed initiatives
3,Robinson LLC,Up-sized fresh-thinking model for embrace back-end niches
4,Cooper-Fernandez,User-friendly motivating encoding for harness frictionless info-mediaries
5,Moody Ltd,Configurable clear-thinking standardization for mesh web-enabled systems
6,Gonzalez Group,Triple-buffered leadingedge capacity for morph end-to-end initiatives
7,"Huynh, Baker and Davis",Synergistic dedicated encryption for repurpose transparent partnerships
8,"Austin, Parker and Cain",Diverse modular frame for envisioneer back-end architectures
9,Young-Roberts,Distributed bandwidth-monitored pricing structure for exploit robust models
10,Butler-Taylor,Universal multimedia help-desk for engineer value-added initiatives
11,Davis-Gilbert,Exclusive multimedia project for transition intuitive e-commerce
12,Mccann-Henry,Face-to-face fault-tolerant algorithm for syndicate dot-com e-business
13,Hall-Reese,Pre-emptive eco-centric portal for deploy cross-media convergence
14,Castillo-Rose,Team-oriented didactic open system for revolutionize next-generation e-tailers
15,White Inc,Centralized upward-trending emulation for drive distributed metrics
16,Martinez-Armstrong,Multi-tiered global model for re-intermediate leading-edge portals
17,Martin-Howard,Multi-channeled client-server core for grow seamless vortals
18,Goodwin PLC,Synergistic asynchronous hardware for reinvent dot-com relationships
19,Horn PLC,Fundamental multi-state archive for drive customized infrastructures
20,Allen-Melendez,Innovative asynchronous flexibility for re-contextualize revolutionary e-services
21,"Jackson, Morgan and Ross",Cross-platform systemic initiative for mesh frictionless content
22,Scott-Davis,Configurable stable middleware for leverage innovative niches
23,Sullivan Group,Enhanced interactive attitude for strategize distributed methodologies
24,"Johnson, Short and May",Managed holistic system engine for matrix killer methodologies
25,Morse and Sons,Stand-alone dynamic implementation for productize plug-and-play e-services
26,Contreras-Glenn,Persistent 24hour leverage for e-enable B2B bandwidth
27,"Price, Johnson and Hendrix",Decentralized systemic monitoring for extend innovative web-readiness
28,"Weaver, Chambers and King",Up-sized eco-centric architecture for whiteboard bricks-and-clicks solutions
29,Hoover-Robinson,Open-source zero-defect application for visualize cross-media relationships
30,Hall-Ball,Cloned scalable open system for deploy sticky functionalities
31,Morales-Bishop,Up-sized impactful website for utilize leading-edge metrics
32,Powers-Franco,Mandatory tangible instruction set for morph scalable e-markets
33,Gould-Wilson,Operative eco-centric utilization for unleash B2B e-business
34,Zamora LLC,Operative zero-defect collaboration for deliver revolutionary architectures
35,"Turner, Michael and Banks",Advanced incremental methodology for extend extensible convergence
36,Carpenter-Reynolds,Multi-channeled scalable knowledgebase for disintermediate clicks-and-mortar methodologies
37,"Jennings, Vance and Wilkins",Visionary impactful open system for morph turn-key applications
38,"Cowan, Wright and Maddox",Extended hybrid standardization for architect revolutionary web services
39,Mcmahon Ltd,Multi-lateral asymmetric contingency for orchestrate granular networks
40,Carson and Sons,Focused directional monitoring for redefine virtual markets
41,Dawson Ltd,Persistent eco-centric Internet solution for repurpose 24/7 synergies
42,Reyes Inc,Realigned analyzing artificial intelligence for orchestrate revolutionary content
43,Peterson-Smith,Balanced eco-centric hierarchy for enhance scalable vortals
44,Cooper LLC,Extended upward-trending structure for architect sticky infrastructures
45,"Santiago, Rodriguez and Yoder",Expanded background budgetary management for streamline web-enabled web services
46,"Wade, Johnson and Jones",Synergistic radical system engine for architect impactful e-services
47,"Lynch, Jones and Chavez",Upgradable system-worthy customer loyalty for drive next-generation schemas
48,Cooper PLC,Business-focused demand-driven solution for revolutionize frictionless vortals
49,Lopez Group,Persevering discrete complexity for drive ubiquitous niches
